{
  "version": "1",
  "kind": "BountyFunded",
  "chainGenesis": "0x1111111111111111111111111111111111111111111111111111111111111111",
  "contractLocatorHash": "0x2222222222222222222222222222222222222222222222222222222222222222",
  "transactionHash": "0x3333333333333333333333333333333333333333333333333333333333333333",
  "blockHeight": "1234",
  "logIndex": 0,
  "finalized": false,
  "bountyId": "17",
  "payload": {
    "amountAtoms": "100000000000000"
  }
}
